treat_id,description,icd9
668,Thoracotomy; with diagnostic wedge resection followed by anatomic lung resection (List separately in addition to code for primary procedure),32507
669,"Thoracoscopy; with diagnostic biopsy(ies) of lung nodule(s) or mass(es) (eg, wedge, incisional), unilateral",32608
670,Thoracoscopy; with biopsy(ies) of pleura,32609
671,"Thoracoscopy, surgical; with total pulmonary decortication, including intrapleural pneumonolysis",32652
672,"Thoracoscopy, surgical; with resection-plication of bullae, includes any pleural procedure when performed",32655
673,"Thoracoscopy, surgical; with excision of mediastinal cyst, tumor, or mass",32662
674,"Thoracoscopy, surgical; with therapeutic wedge resection (eg, mass, nodule), initial unilateral",32666
675,"Thoracoscopy, surgical; with therapeutic wedge resection (eg, mass or nodule), each additional resection, ipsilateral (List separately in addition to code for primary procedure)",32667
676,"Thoracoscopy, surgical; with removal of two lobes (bilobectomy)",32670
677,"Thoracoscopy, surgical; with removal of lung (pneumonectomy)",32671
678,"Thoracoscopy, surgical; with resection-plication for emphysematous lung (bullous or non-bullous) for lung volume reduction (LVRS), unilateral includes any pleural procedure, when performed",32672
679,Repair lung hernia through chest wall,32800
680,Open closure of major bronchial fistula,32815
681,"Thoracoplasty, Schede type or extrapleural (all stages);",32905
682,"Pneumonolysis, extraperiosteal, including filling or packing procedures",32940
683,"Pneumothorax, therapeutic, intrapleural injection of air",32960
684,"Mediastinotomy with exploration, drainage, removal of foreign body, or biopsy; cervical approach",39000
685,"Mediastinotomy with exploration, drainage, removal of foreign body, or biopsy; transthoracic approach, including either transthoracic or median sternotomy",39010
686,Resection of mediastinal cyst,39200
687,Resection of mediastinal tumor,39220
688,"Repair, laceration of diaphragm, any approach",39501
689,"Resection, diaphragm; with complex repair (eg, prosthetic material, local muscle flap)",39561
690,Transection or avulsion of; phrenic nerve,64746
691,"Incision and drainage of thyroglossal duct cyst, infected",60000
692,"Excision of cyst or adenoma of thyroid, or transection of isthmus",60200
693,"Partial thyroid lobectomy, unilateral; with or without isthmusectomy",60210
694,"Partial thyroid lobectomy, unilateral; with contralateral subtotal lobectomy, including isthmusectomy",60212
695,"Thyroidectomy, total or complete",60240
696,"Thyroidectomy, total or subtotal for malignancy; with radical neck dissection",60254
697,"Thyroidectomy, removal of all remaining thyroid tissue following previous removal of a portion of thyroid",60260
698,"Thyroidectomy, including substernal thyroid; sternal split or transthoracic approach",60270
699,Excision of thyroglossal duct cyst or sinus,60280
700,Parathyroidectomy or exploration of parathyroid(s),60500
701,"Parathyroidectomy or exploration of parathyroid(s); with mediastinal exploration, sternal split or transthoracic approach",60505
702,Parathyroid autotransplantation (List separately in addition to code for primary procedure),60512
703,Closure of vesicouterine fistula; with hysterectomy,51925
704,"Vaginal hysterectomy, for uterus 250 g or less",58260
705,"Vaginal hysterectomy, for uterus 250 g or less; with removal of tube(s), and/or ovary(s)",58262
706,"Vaginal hysterectomy, for uterus 250 g or less; with repair of enterocele",58270
707,"Vaginal hysterectomy, for uterus 250 g or less;",58275
708,"Vaginal hysterectomy, for uterus greater than 250 g",58290
709,"Vaginal hysterectomy, for uterus greater than 250 g; with removal of tube(s) and/or ovary(s)",58291
710,"Vaginal hysterectomy, for uterus greater than 250 g; with removal of tube(s) and/or ovary(s), with repair of enterocele",58292
711,"Laparoscopy, surgical, with vaginal hysterectomy, for uterus 250 g or less",58550
712,"Laparoscopy, surgical, with vaginal hysterectomy, for uterus 250 g or less; with removal of tubes(s) and /or ovary(s)",58552
713,"Laparoscopy, surgical, with vaginal hysterectomy, for uterus greater than 250 g",58553
714,"Laparoscopy, surgical, with vaginal hysterectomy, for uterus greater than 250 g; with removal of tube(s) and/or ovary(s)",58554
715,"Neuroendoscopy, intracranial, for placement or replacement of ventricular catheter and attachment to shunt system or external drainage (List separately in addition to code for primary procedure)",62160
716,Ventriculocisternostomy (Torkildsen type operation),62180
717,"Creation of shunt; subarachnoid/subdural-peritoneal, -pleural, other terminus",62192
718,"Ventriculocisternostomy, third ventricle; stereotactic, neuroendoscopic method",62201
719,"Creation of shunt; ventriculo-atrial, -jugular, -auricular",62220
720,"Creation of shunt; ventriculo-peritoneal, -pleural, other terminus",62223
721,"Replacement or irrigation, ventricular catheter",62225
722,"Replacement or revision of cerebrospinal fluid shunt, obstructed valve, or distal catheter in shunt system",62230
723,Removal of complete cerebrospinal fluid shunt system; without replacement,62256
724,Exploration of penetrating wound (separate procedure); abdomen/flank/back,20102
725,"Repair, diaphragmatic hernia (other than neonatal), traumatic; chronic",39541
726,"Repair, paraesophageal hiatal hernia (including fundoplication), via laparotomy, except neonatal; without implantation of mesh or other prosthesis",43332
727,Enterolysis (freeing of intestinal adhesion) (separate procedure),44005
728,"Laparoscopy, surgical, enterolysis (freeing of intestinal adhesion) (separate procedure)",44180
729,"Exclusion of small intestine from pelvis by mesh or other prosthesis, or native tissue (eg, bladder or omentum)",44700
730,Excision of lesion of mesentery (separate procedure),44820
731,Suture of mesentery (separate procedure),44850
732,Reopening of recent laparotomy,49002
733,"Exploration, retroperitoneal area with or without biopsy(s) (separate procedure)",49010
734,"Drainage of peritoneal abscess or localized peritonitis, exclusive of appendiceal abscess, open",49020
735,"Drainage of retroperitoneal abscess, open",49060
736,"Excision or destruction, open, intra-abdominal tumors, cysts or endometriomas, 1 or more peritoneal, mesenteric, or retroperitoneal primary or secondary tumors; largest tumor 5 cm diameter or less",49203
737,"Umbilectomy, omphalectomy, excision of umbilicus (separate procedure)",49250
738,"Omentectomy, epiploectomy, resection of omentum (separate procedure)",49255
739,"Laparoscopy, abdomen, peritoneum, and omentum, diagnostic, with or without collection of specimen(s) by brushing or washing (separate procedure)",49320
740," Laparoscopy, surgical; with biopsy (single or multiple) ",49321
741,"Laparoscopy, surgical; with insertion of tunneled intraperitoneal catheter",49324
742,"Laparoscopy, surgical; with revision of previously placed intraperitoneal cannula or catheter, with removal of intraluminal obstructive material if performed",49325
743,Removal of peritoneal foreign body from peritoneal cavity,49402
744,"Insertion of tunneled intraperitoneal catheter, with subcutaneous port (ie, totally implantable)",49419
745,Insertion of peritoneal-venous shunt,49425
746, Revision  of peritoneal-venous shunt,49426
747,"Suture, secondary, of abdominal wall for evisceration or dehiscence",49900
748,"Omental flap, intra-abdominal (List separately in addition to code for primary procedure)",49905
749,Free omental flap with microvascular anastomosis,49906
750,"Laparotomy, for staging or restaging of ovarian, tubal, or primary peritoneal malignancy (second look), with or without omentectomy, peritoneal washing, biopsy of abdominal and pelvic peritoneum, diaphragmatic assessment with pelvic and limited para-aortic lymphadenectomy",58960
