treat_id,description,icd9
452,"Laparoscopy, surgical, total hysterectomy for resection of malignancy (tumor debulking), with omentectomy including salpingo-oophorectomy, unilateral or bilateral, when performed",58575
453,"Arthroplasty, knee, tibial plateau",27440
454,"Arthroplasty, knee, tibial plateau; with debridement and partial synovectomy",27441
455,"Arthroplasty, femoral condyles or tibial plateau(s), knee; with debridement and partial synovectomy",27443
456,"Arthroplasty, knee, condyle and plateau; medial OR lateral compartment",27446
457,"Arthroplasty, knee, condyle and plateau; medial AND lateral compartments with or without patella resurfacing (total knee arthroplasty)",27447
458,"Revision of total knee athroplasty, with or without allograft, one component",27486
459,"Revision of total knee arthroplasty, with or without allograft; femoral and entire tibial component",27487
460,Recipient nephrectomy (separate procedure)  ,50340
461,"Renal allotransplantation, implantation of graft; without recipient nephrectomy ",50360
462,"Renal allotransplantation, implantation of graft; with recipient nephrectomy ",50365
463,"Renal autotransplantation, reimplantation of kidney ",50380
464,"Osteotomy of spine, including discectomy, anterior approach, single vertebral segment; cervical",22220
465,"Osteotomy of spine, including discectomy, anterior approach, single vertebral segment; thoracic",22222
466,"Osteotomy of spine, including discectomy, anterior approach, single vertebral segment; lumbar",22224
467,"Total disc arthroplasty (artificial disc), anterior approach, including discectomy with end plate preparation (includes osteophytectomy for nerve root or spinal cord decompression and microdissection); single interspace, cervical",22856
468,"Revision including replacement of total disc arthroplasty (artificial disc), anterior approach, single interspace; cervical",22861
469,"Revision including replacement of total disc arthroplasty (artificial disc), anterior approach, single interspace; lumbar",22862
470,"Insertion of interlaminar/interspinous process stabilization/distraction device, without fusion, including image guidance when performed, with open decompression, lumbar; single level ",22867
471,"Decompression procedure, percutaneous, of nucleus pulposus of intervertebral disc, any method utilizing needle based technique to remove disc material under fluoroscopic imaging or other form of indirect visualization, with the use of an endoscope, with discography and/or epidural injection(s) at the treated level(s), when performed, single or multiple levels, lumbar",62287
472,"Laminectomy with exploration and/or decompression of spinal cord and/or cauda equina, without facetectomy, foraminotomy or discectomy (eg, spinal stenosis), 1 or 2 vertebral segments; cervical",63001
473,"Laminectomy with exploration and/or decompression of spinal cord and/or cauda equina, without facetectomy, foraminotomy or discectomy (eg, spinal stenosis), 1 or 2 vertebral segments; sacral",63011
474,"Laminectomy with exploration and/or decompression of spinal cord and/or cauda equina, without facetectomy, foraminotomy or discectomy (eg, spinal stenosis), more than 2 vertebral segments; cervical",63015
475,"Laminectomy with exploration and/or decompression of spinal cord and/or cauda equina, without facetectomy, foraminotomy or discectomy (eg, spinal stenosis), more than 2 vertebral segments; lumbar",63017
476,"Laminotomy (hemilaminectomy), with decompression of nerve root(s), including partial facetectomy, foraminotomy and/or excision of herniated intervertebral disc; 1 interspace, cervical",63020
477,"Laminotomy (hemilaminectomy), with decompression of nerve root(s), including partial facetectomy, foraminotomy and/or excision of herniated intervertebral disc; 1 interspace, lumbar",63030
478,"Laminotomy (hemilaminectomy), with decompression of nerve root(s), including partial facetectomy, foraminotomy and/or excision of herniated intervertebral disc, reexploration, single interspace; cervical",63040
479,"Laminotomy (hemilaminectomy), with decompression of nerve root(s), including partial facetectomy, foraminotomy and/or excision of herniated intervertebral disc, reexploration, single interspace; lumbar",63042
480,"Laminectomy, facetectomy and foraminotomy (unilateral or bilateral with decompression of spinal cord, cauda equina and/or nerve root[s], [eg, spinal or lateral recess stenosis]), single vertebral segment; cervical",63045
481,"Laminectomy, facetectomy and foraminotomy (unilateral or bilateral with decompression of spinal cord, cauda equina and/or nerve root[s], [eg, spinal or lateral recess stenosis]), single vertebral segment; thoracic",63046
482,"Laminectomy, facetectomy and foraminotomy (unilateral or bilateral with decompression of spinal cord, cauda equina and/or nerve root[s], [eg, spinal or lateral recess stenosis]), single vertebral segment; lumbar",63047
483,"Laminectomy, facetectomy and foraminotomy (unilateral or bilateral with decompression of spinal cord, cauda equina and/or nerve root[s], [eg, spinal or lateral recess stenosis]), single vertebral segment; each additional segment, cervical, thoracic, or lumbar (List separately in addition to code for primary procedure)",63048
484,"Laminoplasty, cervical, with decompression of the spinal cord, 2 or more vertebral segments;",63050
485,"Laminoplasty, cervical, with decompression of the spinal cord, 2 or more vertebral segments; with reconstruction of the posterior bony elements (including the application of bridging bone graft and non-segmental fixation devices [eg, wire, suture, mini-plates], when performed)",63051
486,"Discectomy, anterior, with decompression of spinal cord and/or nerve root(s), including osteophytectomy; cervical, single interspace",63075
487,"Discectomy, anterior, with decompression of spinal cord and/or nerve root(s), including osteophytectomy; thoracic, single interspace",63077
488,"Vertebral corpectomy (vertebral body resection), partial or complete, anterior approach with decompression of spinal cord and/or nerve root(s); cervical, single segment",63081
489,"Vertebral corpectomy (vertebral body resection), partial or complete, anterior approach with decompression of spinal cord and/or nerve root(s); cervical, each additional segment (List separately in addition to code for primary procedure)",63082
490,"Vertebral corpectomy (vertebral body resection), partial or complete, transthoracic approach with decompression of spinal cord and/or nerve root(s); thoracic, single segment",63085
491,"Vertebral corpectomy (vertebral body resection), partial or complete, combined thoracolumbar approach with decompression of spinal cord, cauda equina or nerve root(s), lower thoracic or lumbar; single segment",63087
492,"Vertebral corpectomy (vertebral body resection), partial or complete, combined thoracolumbar approach with decompression of spinal cord, cauda equina or nerve root(s), lower thoracic or lumbar; each additional segment (List separately in addition to code for primary procedure)",63088
493,"Vertebral corpectomy (vertebral body resection), partial or complete, transperitoneal or retroperitoneal approach with decompression of spinal cord, cauda equina or nerve root(s), lower thoracic, lumbar, or sacral; single segment",63090
494,"Vertebral corpectomy (vertebral body resection), partial or complete, transperitoneal or retroperitoneal approach with decompression of spinal cord, cauda equina or nerve root(s), lower thoracic, lumbar, or sacral; each additional segment (List separately in addition to code for primary procedure)",63091
495,"Laminectomy with myelotomy (eg, Bischof or DREZ type), cervical, thoracic, or thoracolumbar",63170
496,Laminectomy with drainage of intramedullary cyst/syrinx; to peritoneal or pleural space,63173
497,Laminectomy with rhizotomy; 1 or 2 segments,63185
498,"Laminectomy with cordotomy, with section of 1 spinothalamic tract, 1 stage; thoracic",63195
499,"Laminectomy with cordotomy, with section of both spinothalamic tracts, 1 stage; cervical",63196
500,"Placement of a posterior intrafacet implant(s), unilateral or bilateral, including imaging and placement of bone graft(s) or synthetic device(s), single level; cervical",0219T
501,"Placement of a posterior intrafacet implant(s), unilateral or bilateral, including imaging and placement of bone graft(s) or synthetic device(s), single level; thoracic",0220T
502,"Total disc arthroplasty (artificial disc), anterior approach, including discectomy with end plate preparation (includes osteophytectomy for nerve root or spinal cord decompression and microdissection), cervical, three or more levels",0375T
503,"Liver allotransplantation; orthotopic, partial or whole, from cadaver or living donor, any age ",47135
504,"Laryngotomy (thyrotomy, laryngofissure); with removal of tumor or laryngocele, cordectomy ",31300
505,"Laryngectomy; subtotal supraglottic, without radical neck dissection  ",31367
506,Partial laryngectomy (hemilaryngectomy); horizontal  ,31370
507,Partial laryngectomy (hemilaryngectomy); laterovertical,31375
508,Partial laryngectomy (hemilaryngectomy); anterovertical  ,31380
509,Partial laryngectomy (hemilaryngectomy); antero-latero-vertical  ,31382
510,"Pharyngolaryngectomy, with radical neck dissection; without reconstruction  ",31390
511,"Pharyngolaryngectomy, with radical neck dissection; with reconstruction  ",31395
512,"Arytenoidectomy or arytenoidopexy, external approach  ",31400
513,"Laryngoplasty; for laryngeal stenosis, with graft, without indwelling stent placement, younger than 12 years of age",31551
514,"Laryngoplasty; for laryngeal stenosis, with graft, without indwelling stent placement, age 12 years or older ",31552
515,"Laryngoplasty; for laryngeal stenosis, with graft, with indwelling stent placement, younger than 12 years of age ",31553
516,"Laryngoplasty; for laryngeal stenosis, with graft, with indwelling stent placement, age 12 years or older",31554
517,"Laryngoplasty, medialization, unilateral ",31591
518,"Unlisted procedure, larynx  ",31599
519,"Dissection, deep jugular node(s)  ",38542
520,"Glossectomy; complete or total, with or without tracheostomy, without radical neck dissection  ",41140
521,"Glossectomy; complete or total, with or without tracheostomy, with unilateral radical neck dissection  ",41145
522,"Excision of parotid tumor or parotid gland; total, en bloc removal with sacrifice of facial nerve  ",42425
523,"Excision of parotid tumor or parotid gland; total, with unilateral radical neck dissection  ",42426
524,Radical excision external auditory canal lesion; without neck dissection  ,69150
525,Radical excision external auditory canal lesion; with neck dissection  ,69155
526," Renal exploration, not necessitating other specific procedures  ",50010
527,"Drainage of perirenal or renal abscess, open  ",50020
528,"Nephrostomy, nephrotomy with drainage  ",50040
529,"Nephrotomy, with exploration  ",50045
530,Nephrolithotomy; removal of calculus  ,50060
531,Nephrolithotomy; secondary surgical operation for calculus  ,50065
532,Nephrolithotomy; removal of large staghorn calculus filling renal pelvis and calyces (including anatrophic pyelolithotomy)  ,50075
533,"Pyelotomy; complicated (e.g., secondary operation, congenital kidney abnormality)  ",50135
534,Renal biopsy; by surgical exposure of kidney ,50205
535,"Nephrectomy, including partial ureterectomy, any open approach including rib resection; complicated because of previous surgery on same kidney  ",50225
536,"Nephrectomy, including partial ureterectomy, any open approach including rib resection; radical, with regional lymphadenectomy and/or vena caval thrombectomy  ",50230
537,Nephrectomy with total ureterectomy and bladder cuff; through same incision  ,50234
538,Nephrectomy with total ureterectomy and bladder cuff; through separate incision  ,50236
539,"Nephrectomy, partial  ",50240
540,"Ablation, open, 1 or more renal mass lesion(s), cryosurgical, including intraoperative ultrasound guidance and monitoring, if performed ",50250
541,Excision or unroofing of cyst(s) of kidney ,50280
542,Excision of perinephric cyst  ,50290
543,"Donor nephrectomy (including cold preservation); open, from living donor  ",50320
544,"Pyeloplasty (Foley Y-pyeloplasty), plastic operation on renal pelvis, with or without plastic operation on ureter, nephropexy, nephrostomy, pyelostomy, or ureteral splinting; complicated (congenital kidney abnormality, secondary pyeloplasty, solitary kidney, calycoplasty) ",50405
545,"Laparoscopy, surgical; ablation of renal cysts ",50541
546,"Laparoscopy, surgical; partial nephrectomy  ",50543
547,"Laparoscopy, surgical; radical nephrectomy (includes removal of Gerota's fascia and surrounding fatty tissue, removal of regional lymph nodes, and adrenalectomy)  ",50545
548,Unlisted laparoscopic nephrectomy,50549
549,"Laparoscopy, surgical; with lysis of adhesions (salpingolysis, ovariolysis) (separate procedure) ",58660
550,"Lysis of adhesions (salpingolysis, ovariolysis) ",58740
551,"Drainage of ovarian cyst(s), unilateral or bilateral (separate procedure); vaginal approach  ",58800
552,"Drainage of ovarian cyst(s), unilateral or bilateral (separate procedure); abdominal approach  ",58805
553,"Drainage of ovarian abscess; vaginal approach, open  ",58820
554,"Transposition, ovary(s)  ",58825
555,"Ovarian cystectomy, unilateral or bilateral  ",58925
556,"Oophorectomy, partial or total, unilateral or bilateral;",58940
557,"Oophorectomy, partial or total, unilateral or bilateral; for ovarian, tubal or primary peritoneal malignancy, with para-aortic and pelvic lymph node biopsies, peritoneal washings, peritoneal biopsies, diaphragmatic assessments, with or without salpingectomy(s), with or without omentectomy  ",58943
558,"Resection (initial) of ovarian, tubal or primary peritoneal malignancy with bilateral salpingo-oophorectomy and omentectomy;  ",58950
559,"Resection (initial) of ovarian, tubal or primary peritoneal malignancy with bilateral salpingo-oophorectomy and omentectomy; with radical dissection for debulking (i.e., radical excision or destruction, intra-abdominal or retroperitoneal tumors)  ",58952
560,"Follicle puncture for oocyte retrieval, any method  ",58970
561,"Insertion of epicardial electrode(s); open incision (e.g., thoracotomy, median sternotomy, subxiphoid approach)",33202
562,"Insertion of epicardial electrode(s); endoscopic approach (e.g., thoracoscopy, pericardioscopy)",33203
563,Insertion of new or replacement of permanent pacemaker with transvenous electrode(s); atrial ,33206
564,Insertion of new or replacement of permanent pacemaker with transvenous electrode(s); ventricular ,33207
565,Insertion of new or replacement of permanent pacemaker with transvenous electrode(s); atrial and ventricular ,33208
566,Insertion of pacemaker pulse generator only; with existing dual leads ,33213
567," Upgrade of implanted pacemaker system, conversion of single chamber system to dual chamber system (includes removal of previously placed pulse generator, testing of existing lead, insertion of new lead, insertion of new pulse generator) ",33214
568,Repositioning of previously implanted transvenous pacemaker or implantable defibrillator (right atrial or right ventricular) electrode,33215
569,"Insertion of a single transvenous electrode, permanent pacemaker or implantable defibrillator ",33216
570,Repair of 2 transvenous electrodes for permanent pacemaker or implantable defibrillator ,33220
571,Relocation of skin pocket for implantable defibrillator ,33223
572,"Insertion of pacing electrode, cardiac venous system, for left ventricular pacing, with attachment to previously placed pacemaker or implantable defibrillator pulse generator (including revision of pocket, removal, insertion, and/or replacement of existing generator)",33224
573,"Insertion of pacing electrode, cardiac venous system, for left ventricular pacing, at time of insertion of implantable defibrillator or pacemaker pulse generator (e.g., for upgrade to dual chamber system) (List separately in addition to code for primary procedure)",33225
574,"Repositioning of previously implanted cardiac venous system (left ventricular) electrode (including removal, insertion and/or replacement of existing generator)",33226
575,Removal of permanent pacemaker pulse generator with replacement of pacemaker pulse generator; single lead system ,33227
576,Removal of permanent pacemaker pulse generator with replacement of pacemaker pulse generator; dual lead system ,33228
577,Removal of permanent pacemaker pulse generator with replacement of pacemaker pulse generator; multiple lead system ,33229
578,Insertion of implantable defibrillator pulse generator only; with existing dual leads ,33230
579,Insertion of implantable defibrillator pulse generator only; with existing multiple leads ,33231
580,"Removal of transvenous pacemaker electrode(s); single lead system, atrial or ventricular ",33234
581,Removal of transvenous pacemaker electrode(s); dual lead system ,33235
582,Removal of permanent epicardial pacemaker and electrodes by thoracotomy; dual lead system,33237
583,Removal of permanent transvenous electrode(s) by thoracotomy,33238
584,Insertion of implantable defibrillator pulse generator only; with existing single lead ,33240
585,Removal of implantable defibrillator pulse generator only ,33241
586,Removal of implantable defibrillator pulse generator with replacement of implantable defibrillator pulse generator; by transvenous extraction ,33244
587,Removal of implantable defibrillator pulse generator with replacement of implantable defibrillator pulse generator; single lead system ,33262
588,Removal of implantable defibrillator pulse generator with replacement of implantable defibrillator pulse generator; multiple lead system ,33264
589,Insertion of subcutaneous implantable defibrillator electrode,33271
590,Removal of subcutaneous implantable defibrillator electrode,33272
591,"Biopsy, prostate; incisional, any approach",55705
592,"Prostatectomy, perineal radical; with lymph node biopsy(s) (limited pelvic lymphadenectomy)",55812
593,"Prostatectomy, perineal radical; with bilateral pelvic lymphadenectomy, including external iliac, hypogastric and obturator nodes",55815
594,"Prostatectomy (including control of postoperative bleeding, vasectomy, meatotomy, urethral calibration and/or dilation, and internal urethrotomy); suprapubic, subtotal, 1 or 2 stages",55821
595,"Prostatectomy (including control of postoperative bleeding, vasectomy, meatotomy, urethral calibration and/or dilation, and internal urethrotomy); retropubic, subtotal",55831
596,"Prostatectomy, retropubic radical, with or without nerve sparing; with lymph node biopsy(s) (limited pelvic lymphadenectomy)",55842
597,"Prostatectomy, retropubic radical, with or without nerve sparing; with bilateral pelvic lymphadenectomy, including external iliac, hypogastric, and obturator nodes",55845
598,"Laparoscopy, surgical prostatectomy, retropubic radical, including nerve sparing, includes robotic assistance, when performed",55866
599,Bypass graft subclavian- brachial,35512
600,"Bypass graft, with vein; subclavian-axillary",35516
601,"Bypass graft, with vein; axillary-femoral",35521
602,"Bypass graft, with vein; brachial-ulnar or -radial",35523
603,"Bypass graft, with vein; femoral-popliteal",35556
604,"Bypass graft, with vein; femoral-femoral",35558
605,"Bypass graft, with vein; popliteal-tibial, -peroneal artery or other distal vessels",35571
606,In-situ vein bypass; femoral-popliteal,35583
607,"Bypass graft, with other than vein; subclavian-axillary",35616
608,"Bypass graft, with other than vein; axillary-femoral",35621
609,"Bypass graft, with other than vein; axillary-popliteal or -tibial",35623
610,"Bypass graft, with other than vein; axillary-axillary",35650
611,"Bypass graft, with other than vein; axillary-femoral-femoral",35654
612,"Bypass graft, with other than vein; femoral-popliteal",35656
613,"Bypass graft, with other than vein; femoral-femoral",35661
614,"Proctectomy; partial resection of rectum, transabdominal approach",45111
615,"Proctectomy, partial, with rectal mucosectomy, ileoanal anastomosis, creation of ileal reservoir (S or J), with or without loop ileostomy",45113
616,"Proctectomy, partial, with anastomosis; abdominal and transsacral approach",45114
617,"Proctectomy, partial, with anastomosis; transsacral approach only (Kraske type)",45116
618,"Proctectomy, combined abdominoperineal pull-through procedure (eg, colo-anal anastomosis), with creation of colonic reservoir (eg, J-pouch), with diverting enterostomy when performed",45119
619,"Proctectomy, complete (for congenital megacolon), abdominal and perineal approach; with subtotal or total colectomy, with multiple biopsies",45121
620,"Pelvic exenteration for colorectal malignancy, with proctectomy (with or without colostomy), with removal of bladder and ureteral transplantations, and/or hysterectomy, or cervicectomy, with or without removal of tube(s), with or without removal of ovary(s), or any combination thereof",45126
621,"Laparoscopy, surgical; proctectomy, combined abdominoperineal pull-through procedure (eg, colo-anal anastomosis), with creation of colonic reservoir (eg, J-pouch), with diverting enterostomy, when performed",45397
622,"Exploration, repair, and presacral drainage for rectal injury; with colostomy",45563
623,Free jejunum transfer with microvascular anastomosis,43496
624,"Duodenotomy, for exploration, biopsy(s), or foreign body removal",44010
625,"Tube or needle catheter jejunostomy for enteral alimentation, intraoperative, any method (List separately in addition to primary procedure)",44015
626,"Enterotomy, small intestine, other than duodenum; for decompression (eg, Baker tube)",44021
627,"Enterectomy, resection of small intestine; each additional resection and anastomosis (List separately in addition to code for primary procedure)",44121
628,"Enterectomy, resection of small intestine; with enterostomy",44125
629,"Enterectomy, resection of small intestine for congenital atresia, single resection and anastomosis of proximal segment of intestine; with tapering",44127
630,"Laparoscopy, surgical; jejunostomy (eg, for decompression or feeding)",44186
631,"Laparoscopy, surgical; enterectomy, resection of small intestine, single resection and anastomosis",44202
632,"Laparoscopy, surgical; each additional small intestine resection and anastomosis (List separately in addition to code for primary procedure)",44203
633,Enterostomy-External Fistulization of Intestines Procedures,44300
634,Continent ileostomy (Kock procedure) (separate procedure),44316
635,"Suture of small intestine (enterorrhaphy) for perforated ulcer, diverticulum, wound, injury or rupture; single perforation",44602
636,"Suture of small intestine (enterorrhaphy) for perforated ulcer, diverticulum, wound, injury or rupture; multiple perforations",44603
637,"Intestinal stricturoplasty (enterotomy and enterorrhaphy) with or without dilation, for intestinal obstruction",44615
638,Closure of intestinal cutaneous fistula,44640
639,Closure of enteroenteric or enterocolic fistula,44650
640,Excision of Meckel's diverticulum (diverticulectomy) or omphalomesenteric duct,44800
641,Excision of ileoanal reservoir with ileostomy,45136
642,Repair of ruptured spleen (splenorrhaphy) with or without partial splenectomy,38115
643,"Laparoscopy, surgical, splenectomy",38120
644,Injection procedure for splenoportography,38200
645,"Excision of chest wall tumor involving ribs, with plastic reconstruction; with mediastinal lymphadenectomy",19272
646,Exploration of penetrating wound (separate procedure); chest,20101
647,Bronchoplasty; graft repair,31770
648,Bronchoplasty; excision stenosis and anastomosis,31775
649,"Thoracotomy, with diagnostic biopsy(ies) of lung infiltrate(s) (eg, wedge, incisional), unilateral",32096
650,"Thoracotomy, with diagnostic biopsy(ies) of lung nodule(s) or mass(es) (eg, wedge, incisional), unilateral",32097
651,Thoracotomy; with exploration,32100
652,Thoracotomy; with control of traumatic hemorrhage and/or repair of lung tear,32110
653,Thoracotomy; with open intrapleural pneumonolysis,32124
654,"Thoracotomy; with cyst(s) removal, includes pleural procedure when performed",32140
655,"Thoracotomy; with resection-plication of bullae, includes any pleural procedure when performed",32141
656,Pleural scarification for repeat pneumothorax,32215
657,"Decortication, pulmonary (separate procedure); total",32220
658,"Pleurectomy, parietal (separate procedure)",32310
659,"Removal of lung, pneumonectomy; with resection of segment of trachea followed by broncho-tracheal anastomosis (sleeve pneumonectomy)",32442
660,"Removal of lung, other than pneumonectomy; single lobe (lobectomy)",32480
661,"Removal of lung, other than pneumonectomy; 2 lobes (bilobectomy)",32482
662,"Removal of lung, other than pneumonectomy; with circumferential resection of segment of bronchus followed by broncho-bronchial anastomosis (sleeve lobectomy)",32486
663,"Removal of lung, other than pneumonectomy; with all remaining lung following previous removal of a portion of lung (completion pneumonectomy)",32488
664,Resection and repair of portion of bronchus (bronchoplasty) when performed at time of lobectomy or segmentectomy (List separately in addition to code for primary procedure),32501
665,"Resection of apical lung tumor (eg, Pancoast tumor), including chest wall resection, rib(s) resection(s), neurovascular dissection, when performed; without chest wall reconstruction(s)",32503
666,"Resection of apical lung tumor (eg, Pancoast tumor), including chest wall resection, rib(s) resection(s), neurovascular dissection, when performed; with chest wall reconstruction",32504
667,"Thoracotomy; with therapeutic wedge resection (eg, mass or nodule), each additional resection, ipsilateral (List separately in addition to code for primary procedure)",32506
